<?xml version="1.0" encoding="utf-8" ?>
<?xml-stylesheet type="text/xsl" href="R00.xsl" ?>
<!DOCTYPE los SYSTEM "R00.dtd">
<los>

<step>Step 1</step>

<pr>Als Anfang ein sehr einfaches Programm.

<i>Der oberste Stapeleintrag soll beginnend mit 0 fortlaufend um 1 erhöht und auf Adresse 2D04 ausgegeben werden.</i>

PC = Speicheradresse des Programmschrittes
PD = Programmcode, gespeichert auf Adresse PC
SP = Stapelhöhe nach Ausführung des Programmschrittes</pr>

<ptable>
  <tr><td> 0000 </td><td> 0000 </td><td> 0       </td><td> 0     </td><td>1</td></tr>
  <tr><td> 0001 </td><td> 0001 </td><td> BEGIN 1 </td><td> 0 1   </td><td>2</td></tr>
  <tr><td> 0002 </td><td> A007 </td><td> +       </td><td> 1     </td><td>1</td></tr>
  <tr><td> 0003 </td><td> B501 </td><td> DUP     </td><td> 1 1   </td><td>2</td></tr>
  <tr><td> 0004 </td><td> 2D04 </td><td> 2D04    </td><td> 1 1 2D04 </td><td>3</td></tr>
  <tr><td> 0005 </td><td> A009 </td><td> !       </td><td> 1     </td><td>1</td></tr>
  <tr><td> 0006 </td><td> 8FFA </td><td> AGAIN   </td><td> 1     </td><td>1</td></tr>
</ptable>

<p>Wer sich noch nicht so sehr mit FORTH auskennt: Anfangs werden "0" und "1" als Zahlen auf den Stapel abgelegt, dann mit "+" addiert, mit "DUP" das Ergebnis dupliziert und "!" speichert das Duplizierte auf der zuvor eingegebenen Adresse "2D04". "AGAIN" springt zurück zu "BEGIN". "BEGIN" ist nur eine Markierung und benötigt selbst keinen eigenen Programmcode.</p>

<p>Genug der Worte, das Programm soll endlich loslaufen. Im Startterminal die Programmversion auswählen:</p>

<Terminal_1>
  <li> git checkout Step_1 </li>
  <li> git diff <diff>Step_0...Step_1</diff> # mit Taste Q beenden </li>
  </Terminal_1>

anschließend in Vivado die Simulation starten:

<Tcl_Console>
  <li> close_sim -force -quiet </li>
  <li> launch_simulation # auch Button "Run Behavioral Simulation" geht </li>
  <li> run 1000 ns </li>
  </Tcl_Console>

<pr><favicon/> Ergebnis: Die Variable LEDS enthält den auf Adresse 2D04 ausgegebenen Hexadezimalwert

ab Zeitpunkt in ns     Wert von LEDS
     0                  UU
   130                  01
   250                  02
   370                  03
   490                  04
   610                  05
   730                  06
   850                  07
   970                  08

Soll LEDS auf echte <a href="http://de.wikipedia.org/wiki/Leuchtdiode">LED</a>'s ausgegeben werden, muss natürlich der Takt CLK passend verringert werden.
</pr>

<weiter /><a href="R02_Stapelvariablen.xml">R02 Stapeleinträge benennen</a>
</los>
