<?xml version="1.0" encoding="utf-8" ?>
<?xml-stylesheet type="text/xsl" href="R00.xsl" ?>
<!DOCTYPE los SYSTEM "R00.dtd">
<los>

<step>Step 9</step>

<pr>Programmausgabe

Variablen:
EMIT_BYTE        = enthält das auszugebende Byte
EMIT_ABGESCHICKT = wird invertiert, wenn ein Byte gesendet wurde,
EMIT_ANGEKOMMEN  = muss vom Empfänger invertiert werden. Das Programm wartet solange mit dem Absenden des nächsten Bytes.

EMIT  ( n --> ) gibt n auf Port EMIT_BYTE aus.

Ein Beispielprogramm wie</pr>
<ptable>
  <tr><td> 0000 </td><td> 0031 </td><td> 54 ( '1' )</td><td> 31    </td><td> 1 </td></tr>
  <tr><td> 0001 </td><td> A005 </td><td> EMIT      </td><td>       </td><td> 0 </td></tr>
  <tr><td> 0002 </td><td> 002E </td><td> 45 ( '.' )</td><td> 2E    </td><td> 1 </td></tr>
  <tr><td> 0003 </td><td> A005 </td><td> EMIT      </td><td>       </td><td> 0 </td></tr>
  <tr><td> 0004 </td><td> 0020 </td><td> 53 ( ' ' )</td><td> 20    </td><td> 1 </td></tr>
  <tr><td> 0005 </td><td> A005 </td><td> EMIT      </td><td>       </td><td> 0 </td></tr>
  <tr><td> 0006 </td><td> 0054 </td><td> 54 ( 'T' )</td><td> 54    </td><td> 1 </td></tr>
  <tr><td> 0007 </td><td> A005 </td><td> EMIT      </td><td>       </td><td> 0 </td></tr>
  <tr><td> 0008 </td><td> 0054 </td><td> 45 ( 'E' )</td><td> 45    </td><td> 1 </td></tr>
  <tr><td> 0009 </td><td> A005 </td><td> EMIT      </td><td>       </td><td> 0 </td></tr>
  <tr><td> 000A </td><td> 0054 </td><td> 53 ( 'S' )</td><td> 53    </td><td> 1 </td></tr>
  <tr><td> 000B </td><td> A005 </td><td> EMIT      </td><td>       </td><td> 0 </td></tr>
  <tr><td> 000C </td><td> 0054 </td><td> 54 ( 'T' )</td><td> 54    </td><td> 1 </td></tr>
  <tr><td> 000D </td><td> A005 </td><td> EMIT      </td><td>       </td><td> 0 </td></tr>
  <tr><td> 000E </td><td> 0054 </td><td> 20 ( ' ' )</td><td> 20    </td><td> 1 </td></tr>
  <tr><td> 000F </td><td> A005 </td><td> EMIT      </td><td>       </td><td> 0 </td></tr>
  </ptable>
  
<p>ist inzwischen etwas dürftig. Ich habe deshalb einen ersten FORTH-Interpreter in ProgRAM (ab PC=0010) und ByteRAM gepackt. Eine Minimalversion, die sich gerade so selbst zum Laufen bringt, mal sehen, ob da schon was gescheites passiert.</p>

<Terminal_1>
  <li> git checkout Step_9 </li>
  <li> git diff <diff>Step_8...Step_9</diff> </li>
  </Terminal_1>

<Tcl_Console>
  <li> close_sim -force -quiet </li>
  <li> launch_simulation </li>
  <li> run 20000 ns </li>
  </Tcl_Console>

<p>Beginnend ab 380 ns wird alle 820 ns auf EMIT ein weiteres Zeichen der Hexadezimalfolge 46-4F-52-54-59-2d-46-4f-52-54-48-0A-0A-6F-6B-0A ausgegeben. In einem echten Terminal würde das etwa so aussehen:</p>

<DEMO>FORTY-FORTH

ok
</DEMO>

<p>Von 900 ns bis 1220 ns wartet der Programmzähler PC darauf, dass von testbench.vhd aus EMIT_EMPFANGEN negiert wird, und so auch bei jedem weiteren ausgegebenen Zeichen. Schließlich ab 15540 ns wiederholt sich endlos eine 420 ns lange Progammschleife - ja weil noch eine Nutzereingabe fehlt...</p>

<weiter /><a href="R10_Nutzereingabe.xml">R10 Nutzereingabe</a>

</los>
