<?xml version="1.0" encoding="utf-8" ?>
<?xml-stylesheet type="text/xsl" href="R00.xsl" ?>
<!DOCTYPE los SYSTEM "R00.dtd">
<los>

<step>Step 11</step>

<pr>Große ganze Zahlen

Zum Rechnen mit großen ganzen Zahlen sind weitere Rechenoperationen eingefügt, welche den Rechenablauf beschleunigen sollen.

DI32 ( a b c --> r q ) teilt die aus a und b zusammengesetzte 32-Bit Zahl a*2^16+b durch c und gibt Rest r und Quotient q zurück.
MULT_I ( ... ) und
MULT_II ( ... ) sind zwei Hilfsfunktionen für die Multiplikation einer 16-Bit-Zahl mit einer ab Adresse adr gespeicherten großen ganzen Zahl der Länge l Bytes.

Hier ist nur aufgeführt, was im VHDL-Programm dazugekommen ist. Wie das alles mit dem FORTH-Interpreter zusammenwirkt und daraus schließlich das Matrix-Invertierungsprogramm gemacht wird, öffne dazu die Datei <a href="screenlog.xml">screenlog.xml</a>. Das ist ein Logfile, welches beim Compilieren des Forth-Interpreters angefertigt wurde. Es enthält den vollständigen FORTH-Quelltext, versehen mit wenigstens ein paar Erläuterungen.

Beispielaufgabe: <i>Invertiere die Matrix

  [ [ 1   1   1    1 ] 
    [ 2   4   8   16 ] 
    [ 3   9  27   81 ]
    [ 4  16  64  256 ] ] </i></pr>

<Terminal_1>
  <li> git checkout Step_11 </li>
  <li> git diff Step_10...Step_11 </li>
  </Terminal_1>

<Tcl_Console>
  <li> close_sim -force -quiet </li>
  <li> launch_simulation </li>
  <li> run 60 ms </li>
  </Tcl_Console>

<p></p>

<DEMO>FORTY-FORTH

ok
<u>56 89 * .</u> 2E06 ok
<u>111111111111111 DUP * .</u> 123456789ABCDEFEDCBA987654321 ok
<u>DECIMAL</u> ok
<u>56 89 * .</u> 4984 ok
<u>[ [ 1   1   1    1 ]</u> ok
<u>  [ 2   4   8   16 ]</u> ok
<u>  [ 3   9  27   81 ]</u> ok
<u>  [ 4  16  64  256 ] ] </u> ok
<u>4 INVERTIEREN</u> 
<u>OVER .</u> [ [ 1152 -864 384 -72 ] [ -1248 1368 -672 132 ] [ 432 -576 336 -72 ] [ -48 72 -48 12 ] ] ok
<u>DUP .</u> 288 ok
</DEMO>

<p>Die Nutzereingaben <u>56 89 * ....</u> beginnen ab 30000 ns in KEY_BYTE. Die Ergebnisse werden jeweils ab 3826300 ns, ab 7552740 ns, ab 11061760 ns auf EMIT_BYTE ausgegeben. Darin enthaltene ESCAPE-Sequenzen wie 1B-5B-33-36-6D (ESC-[-3-6-m) stellen die Schriftfarbe ein. DECIMAL schaltet auf dezimale Zahlenbasis um. INVERTIEREN holt vom Stapel die Matrix [ [ 1 ... ] ] und die Dimension 4 und gibt deren Inverse [ [ 1152 ... ] ] und den gemeinsamen Nenner 288 aller Matrixelemente auf dem Stapel zurück (ab 55243300 ns).</p>  

<weiter /><a href="Spartan3.xml">Installation Spartan3 Board</a>

<svg_path schnips="1 1 -50 -87"/>
</los>