<?xml version="1.0" encoding="utf-8" ?>
<?xml-stylesheet type="text/xsl" href="R00.xsl" ?>
<!DOCTYPE los SYSTEM "R00.dtd">
<los>

<step>Spartan3</step>

<pr>Spartan3

Letzter Schritt war branch <code>Step_10</code> in Terminal-1. Alle für das Spartan3 Board benötigt Dateien befinden sich in einem extra Branch, welcher nicht gleichzeitig mit in Terminal-1 eingestellt werden kann. Deshalb in einem neuen Terminal-2 ein neues leeres Verzeichnis mit einem selbstgewählten Namen <i>your-Spartan3-repo</i> anlegen, in dieses Verzeichnis wechseln und nochmal klonen.</pr>

<sterm>git clone https://github.com/OpaStefanVogel/FORTY-FORTH.git .
git checkout Spartan3_Step_9_und_10</sterm>

<pr>Die Ein- und Ausgabe soll über die serielle Verbindung zum Spartan3 Board erfolgen. Dafür wird ein weiteres Terminal-3 benötigt. Welches Verzeichnis darin eigestellt ist, ist dafür egal. Jedoch kann anstelle <code>/ttyS0</code> auch <code>/ttyS1</code> oder eine andere Eingabe erforderlich sein.</pr>

<yterm>stty -F /dev/ttyS0 115200 raw -cstopb -parenb -crtscts -echo ixon -ixoff
stty raw -echo opost quit ^C isig ixon -ixoff #hiernach ist es finster!!!
cp /dev/ttyS0 /dev/tty &amp; cp /dev/tty /dev/ttyS0
</yterm>

<pr>(alles mit Enter abschließen, man sieht nach dem zweiten stty keine Bildschirmausgabe mehr, in dem Moment ist noch nicht erkennbar, ob es funktioniert)

So, jetzt muss mit <a href="https://en.wikipedia.org/wiki/Xilinx_ISE">Xilinx_ISE</a> ein Projekt mit den Dateien

<i>your-master-repo</i>/P01_top.vhd
<i>your-master-repo</i>/P20_FFP.vhd
<i>your-Spartan3-repo</i>/TopSpartan3.vhd
<i>your-Spartan3-repo</i>/Platine95S3.ucf

angelegt werden, das .bit File generiert und auf den Spartan3 ausgegeben werden. Dann sollte in Terminal-3 wieder</pr>

<ffterm>FORTY-FORTH

ok</ffterm>

<pr>zu sehen sein. Wenn nicht, erstmal mit Eingabe von Enter und ESCAPE versuchen, ob sich da nur was verheddert hat. Sonst bleibt nur, in Terminal 1 und 2 mit <code>git checkout</code> auf vorherige Versionen umzuschalten, .bit erneut zu generieren und auf den Spartan3 auszugeben. Dabei gilt momentan folgende Zuordnung</pr>

<table border="1">
  <tr><th><i>your-master-repo&amp;</i></th><th><i>your-Spartan3-repo&amp;</i></th><th>Ausgabe</th></tr>
  <tr><td>Step_1</td><td>Spartan_Step_1_bis_5_und_8</td><td>LED's</td></tr>
  <tr><td>Step_2</td><td>Spartan_Step_1_bis_5_und_8</td><td>LED's</td></tr>
  <tr><td>Step_3</td><td>Spartan_Step_1_bis_5_und_8</td><td>LED's</td></tr>
  <tr><td>Step_4</td><td>Spartan_Step_1_bis_5_und_8</td><td>LED's</td></tr>
  <tr><td>Step_5</td><td>Spartan_Step_1_bis_5_und_8</td><td>LED's</td></tr>
  <tr><td>Step_6</td><td>Spartan_Step_6_und_7</td><td>LED's</td></tr>
  <tr><td>Step_7</td><td>Spartan_Step_6_und_7</td><td>LED's</td></tr>
  <tr><td>Step_8</td><td>Spartan_Step_1_bis_5_und_8</td><td>LED's</td></tr>
  <tr><td>Step_9</td><td>Spartan_Step_9_und_10</td><td>serieller Ausgang</td></tr>
  <tr><td>Step_10</td><td>Spartan_Step_9_und_10</td><td>serieller Ausgang</td></tr>
  </table>
  
<pr>Anstelle oder nach einigen Tastatureingaben in Terminal-3 hinein geht auch in Terminal-1</pr>

<term>cp FFINIT1.TXT /dev/ttyS0 # recompiliert den vorhandenen FORTH-Interpreter 
cp FFINIT2.TXT /dev/ttyS0 # erste Erweiterungen
cp DEMO.TXT /dev/ttyS0 # DEMO-File</term><weiter />Pause
</los>
